{
 "name": "tambon_replay_summary",
 "schema_id": "https://floodguard.th/contracts/tambon-replay-summary.schema.json",
 "metadata": {
  "floodguard_export": "tambon_replay_summary.json",
  "title": "Per-subdistrict replay summary at the modelled peak: water, residents, roads and walking access (modelled, not observed)",
  "title_th": "สรุปผลการย้อนดูรายตำบล ณ ระดับน้ำสูงสุดตามแบบจำลอง: น้ำ ผู้อยู่อาศัย ถนน และการเดินถึงที่พักพิง (ค่าจากแบบจำลอง ไม่ใช่ค่าที่สังเกตได้)",
  "tier": "T1 scenario (model) replay of a reconstructed 2024 event for preparedness planning and exercises; illustrative stage keyframes; not a forecast, not an observed closure record, not an official warning; non_operational; accepted_* null",
  "tier_th": "การย้อนดูสถานการณ์จำลองระดับ T1 (แบบจำลอง) ของเหตุการณ์ปี 2567 (2024) ที่จำลองขึ้นใหม่ เพื่อการวางแผนเตรียมความพร้อมและการฝึกซ้อม ใช้จุดกำหนดระดับน้ำเพื่อการอธิบาย ไม่ใช่การพยากรณ์ ไม่ใช่บันทึกการปิดถนนที่สังเกตได้จริง ไม่ใช่การเตือนภัยอย่างเป็นทางการ ไม่ใช้ในการปฏิบัติการ และไม่มีคะแนนหรือระดับการดำเนินการที่ยอมรับ (accepted_* เป็น null)",
  "operational_status": "non_operational",
  "confidence_class": "low",
  "confidence_reason": "The tables come from a terrain-model reconstruction with illustrative stages, WorldPop 2020 residents, OpenStreetMap roads and sites, and unverified capacity estimates; nothing was checked on the ground.",
  "confidence_reason_th": "ตารางมาจากการจำลองด้วยแบบจำลองภูมิประเทศและระดับน้ำสมมุติ ผู้อยู่อาศัยตาม WorldPop 2020 ถนนและสถานที่จาก OpenStreetMap และค่าประมาณความจุที่ยังไม่ได้ตรวจสอบ ยังไม่มีการตรวจสอบในพื้นที่",
  "lanes": "SCN",
  "source_timestamp": "OpenStreetMap extract 2026-07-09 (roads and sites); WorldPop 2020; reported shelters compiled 2026-09-27; illustrative stage keyframes for 2024-09-09/2024-09-19 ICT on the Copernicus DEM (2011-2015 acquisitions); peak keyframe 2024-09-12T12:00:00+07:00",
  "generated_at": "2026-10-12T06:00:00Z",
  "generated_by": "scripts/build_mae_sai_flood_timeline.py",
  "study": "mae-sai-2024-flood-timeline r5",
  "accepted": "accepted_fpps=null; accepted_action_class=null (no priority score and no action class is computed)",
  "licence": "ODbL 1.0 (https://opendatacommons.org/licenses/odbl/1-0/): OpenStreetMap-derived, attribution and share-alike",
  "licence_th": "ODbL 1.0: ดัดแปลงจาก OpenStreetMap ต้องแสดงที่มาและเผยแพร่งานดัดแปลงภายใต้สัญญาอนุญาตเดียวกัน",
  "attribution": "© OpenStreetMap contributors; WorldPop (www.worldpop.org), University of Southampton; OCHA / HDX Thailand COD-AB; © DLR e.V. 2010-2014 and © Airbus Defence and Space GmbH 2014-2018, provided under COPERNICUS by the European Union and ESA; FloodGuard desk research of public reporting, sources linked per site",
  "licence_inputs": "OpenStreetMap roads and candidate facilities (Geofabrik extract): ODbL 1.0; WorldPop Thailand 100 m population 2020, unconstrained top-down (tha_ppp_2020): CC BY 4.0; HDX Thailand COD-AB subdistrict boundaries v01: CC BY-IGO; Copernicus DEM GLO-30 (tiles N20 E099 and N20 E100): Copernicus DEM licence (free, attribution); Shelters reported in use in September 2024 (FloodGuard desk research): Facts with citations; OSM-derived coordinates © OpenStreetMap contributors (ODbL)",
  "not_included": "No HII rain values (CC BY-NC), nothing from a source without a stated licence and nothing from UNOSAT/GISTDA product 4009 is in this file.",
  "not_included_th": "ไฟล์นี้ไม่มีค่าปริมาณฝนของ สสน. (CC BY-NC) ไม่มีข้อมูลจากแหล่งที่ไม่ระบุสัญญาอนุญาต และไม่มีข้อมูลใดจากผลิตภัณฑ์ 4009 ของ UNOSAT/GISTDA",
  "assumption_1": "The water is a HAND terrain-model reconstruction driven by illustrative stage keyframes (no gauge record was used): modelled, not observed.",
  "assumption_1_th": "น้ำเป็นการจำลองจากแบบจำลองภูมิประเทศ HAND ด้วยจุดกำหนดระดับน้ำเพื่อการอธิบาย (ไม่ได้ใช้ข้อมูลจากสถานีวัดน้ำ) เป็นค่าจากแบบจำลอง ไม่ใช่ค่าที่สังเกตได้",
  "assumption_2": "Every figure is for the modelled peak only: the illustrative 3.5 m stage keyframe at 2024-09-12T12:00:00+07:00 (ICT, UTC+7).",
  "assumption_2_th": "ตัวเลขทุกตัวเป็นค่า ณ ระดับน้ำสูงสุดของแบบจำลองเท่านั้น คือจุดกำหนดระดับน้ำเพื่อการอธิบายที่ 3.5 ม. เวลา 2024-09-12T12:00:00+07:00 (เวลาประเทศไทย UTC+7)",
  "assumption_3": "Flooded area and residents in water are counted per subdistrict on the replay's 10 m grid, outside mapped channels. Residents are WorldPop 2020 modelled residents, not the 2024 population, tourists or traders.",
  "assumption_3_th": "พื้นที่น้ำท่วมและผู้อยู่อาศัยในพื้นที่น้ำท่วมนับรายตำบลบนกริด 10 ม. ของการย้อนดู ไม่รวมร่องน้ำในแผนที่ ผู้อยู่อาศัยเป็นประชากรตามแบบจำลอง WorldPop 2020 ไม่ใช่ประชากรปี 2567 (2024) นักท่องเที่ยว หรือผู้ค้า",
  "assumption_4": "Impassable road length sums the modelled road pieces of the subdistrict whose reconstructed depth reaches 0.3 m at the peak. Bridge decks are not modelled, and no closure report was used.",
  "assumption_4_th": "ความยาวถนนที่สัญจรไม่ได้คือผลรวมของถนนช่วงต่าง ๆ ในตำบลที่ความลึกจำลองถึง 0.3 ม. ณ ระดับน้ำสูงสุด ไม่ได้จำลองพื้นสะพาน และไม่ได้ใช้รายงานการปิดถนน",
  "assumption_5": "A resident has access when a dry shelter of the set is within a 2 km walk on roads that are still passable. Two sets are given side by side, the sites reported in use in September 2024 and the first 8 sites of the modelled coverage ranking, each against its own baseline and counted two ways (all residents at road nodes, and residents whose homes flood at the modelled peak). Nothing here grades a set or a subdistrict.",
  "assumption_5_th": "ผู้อยู่อาศัยเข้าถึงได้เมื่อมีที่พักพิงที่ไม่ถูกน้ำท่วมของชุดนั้นภายในระยะเดิน 2 กม. บนถนนที่ยังสัญจรได้ แสดงสองชุดเคียงกัน คือสถานที่ที่มีรายงานว่าใช้ในเดือนกันยายน 2567 (2024) และ 8 แห่งแรกของการจัดอันดับความครอบคลุมตามแบบจำลอง แต่ละชุดเทียบกับฐานของตัวเอง และนับสองแบบ (ผู้อยู่อาศัยทั้งหมดที่จุดถนน และผู้ที่บ้านถูกน้ำท่วมที่ระดับสูงสุดของแบบจำลอง) ตัวเลขไม่ได้ตัดสินชุดหรือตำบลใด",
  "assumption_6": "No priority score and no action class is computed for any subdistrict: the replay computes neither.",
  "assumption_6_th": "ไม่มีการคำนวณคะแนนลำดับความสำคัญหรือระดับการดำเนินการของตำบลใด การย้อนดูไม่ได้คำนวณทั้งสองอย่าง",
  "assumption_7": "The comparison of this subdistrict with the 2024 season envelope is in the envelope's statistics file, which the replay manifest names at season_envelope.files.statistics. That file is shared under its product's own licence (CC BY-SA 4.0) and this file keeps one licence lineage (ODbL 1.0), so its figures are not copied here. It is a scenario plausibility comparison, not a validation.",
  "assumption_7_th": "การเปรียบเทียบตำบลนี้กับขอบเขตน้ำตลอดฤดูปี 2567 (2024) อยู่ในไฟล์สถิติของขอบเขตน้ำ ซึ่งไฟล์กำกับของการย้อนดูระบุไว้ที่ season_envelope.files.statistics ไฟล์นั้นเผยแพร่ภายใต้สัญญาอนุญาตของผลิตภัณฑ์ต้นทาง (CC BY-SA 4.0) ส่วนไฟล์นี้มีสายสัญญาอนุญาตเดียว (ODbL 1.0) จึงไม่ได้คัดลอกตัวเลขมาไว้ที่นี่ การเปรียบเทียบนี้เป็นการดูความเป็นไปได้ของสถานการณ์จำลอง ไม่ใช่การยืนยันความถูกต้อง",
  "input_receipt": "docs/mae_sai_timeline_r5_input_receipt.json lists every input file of the bake with its SHA-256 (also timeline.json input_sha256); input_set_sha256=926a31dc88a7a28b9dd9dce18638abee5b6284c0f8e693b00352c17546395250",
  "input_sha256": "repo:outputs/mae_sai_road_risk.geojson=cd8648f8fbaabab14fdf45e9e98fff36d90902580831513be39a5dfe0af4439c; repo:outputs/mae_sai_access_edges.csv=266fd0f662b44b8210fc5ab064eadbb26b822ccb869221c92d666f4b172de454; repo:outputs/mae_sai_population_nodes.csv=172235bb7954bb8a60d944c5acc8414e3f73c6b7c204a84e10c3b0b35411f4ac; repo:outputs/mae_sai_admin_context.geojson=5cd03ca936c188d37704f5249afa87da0c687b967db8a0f9c9ebd72b27204db1; repo:outputs/mae_sai_reported_shelters_2024.json=674d95881b857916f65f864e555a1b20f815a25bd9c43e2d475fc0c8f2d00d35; external:open_context/osm_geofabrik/thailand-latest.osm.pbf=b7f46018249638413b1d318bc86519f140c27af20cac7c00d42fe03775b7add1; repo:outputs/mae_sai_facilities.geojson=5f9d2381fc6dccec5343e48e6526a92f80028840e27e4753bb3fbb42445b97ce; external:open_context/worldpop_population/tha_ppp_2020.tif=fb39d85dd150c45c7b25771f29bcd548e611afa0967224ac6d8ca05727230e20; external:open_context/copernicus_dem_glo30/Copernicus_DSM_COG_10_N20_00_E099_00_DEM.tif=8965f85514b577b4b606c658412bfe3d713c0abf478d237539af309d8edb3757; external:open_context/copernicus_dem_glo30/Copernicus_DSM_COG_10_N20_00_E100_00_DEM.tif=353574d52c8d93f0e650207acf4c9045bcebe02bb956b30ca1596cb2dafa17bf",
  "git_commit": "null: a file cannot hold the hash of the commit that adds it; git log -1 --format=%H -- apps/web/public/studies/mae-sai-2024-timeline/r5/exports/tambon_replay_summary.json",
  "knee_k": "8",
  "peak_stage_m": "3.5",
  "peak_local_time": "2024-09-12T12:00:00+07:00",
  "records": "one per subdistrict, in the order of the replay's subdistrict list",
  "fields": [
   {
    "key": "tambon_id",
    "th": "รหัสตำบล",
    "en": "Subdistrict code (COD-AB ADM3)"
   },
   {
    "key": "tambon_name_th",
    "th": "ชื่อตำบล",
    "en": "Subdistrict name in Thai"
   },
   {
    "key": "tambon_name_en",
    "th": "ชื่อตำบลภาษาอังกฤษ",
    "en": "Subdistrict name in English"
   },
   {
    "key": "lane",
    "th": "ช่องทางของหลักฐาน",
    "en": "Evidence lane of the record's figures: SCN, scenario (model)"
   },
   {
    "key": "evidence_tier",
    "th": "ระดับของหลักฐาน",
    "en": "T1 scenario (model): modelled, not observed"
   },
   {
    "key": "confidence_class",
    "th": "ระดับความเชื่อมั่น",
    "en": "Confidence class of the figures (low)"
   },
   {
    "key": "source_timestamp",
    "th": "เวลาของข้อมูลต้นทาง",
    "en": "The dated inputs the figures come from"
   },
   {
    "key": "generated_at",
    "th": "เวลาที่สร้างไฟล์",
    "en": "When the replay's files were generated (declared, not a clock reading)"
   },
   {
    "key": "operational_status",
    "th": "สถานะการใช้งาน",
    "en": "non_operational: not for emergency response or evacuation orders"
   },
   {
    "key": "assumptions",
    "th": "สมมติฐาน",